{
  "schema_version": "curve.manual-plan-input-identity/v2-candidate",
  "workspace_id": "30000000-0000-4000-8000-000000000001",
  "initiative_id": "30000000-0000-4000-8000-000000000002",
  "approved_subject_ref": {
    "entity_id": "30000000-0000-4000-8000-000000000004",
    "digest": "sha256:dddddddddddddddddddddddddddddddddddddddddddddddddddddddddddddddd"
  },
  "prd_artifact_version_id": "30000000-0000-4000-8000-000000000015",
  "prd_content_digest": "sha256:2222222222222222222222222222222222222222222222222222222222222222",
  "evidence_snapshot_id": "30000000-0000-4000-8000-000000000014",
  "scope_revision_ref": {
    "entity_id": "30000000-0000-4000-8000-000000000005",
    "digest": "sha256:1111111111111111111111111111111111111111111111111111111111111111"
  },
  "manual_profile_ref": {
    "entity_id": "20000000-0000-4000-8000-000000000201",
    "digest": "sha256:16ddfbb742fb06e370e1c2db3723eb98c826e1454bf237d97f678656649314a4"
  },
  "definition_ref": {
    "object_id": "30000000-0000-4000-8000-000000000013",
    "digest": "sha256:d0a5d25d0f56f2936d1c812f401c39e1e30d5753eed35fc19f3c9a601ff1eda8",
    "size_bytes": 7771,
    "media_type": "application/json"
  },
  "workflow_ref": {
    "entity_id": "30000000-0000-4000-8000-000000000008",
    "digest": "sha256:eeeeeeeeeeeeeeeeeeeeeeeeeeeeeeeeeeeeeeeeeeeeeeeeeeeeeeeeeeeeeeee"
  },
  "quality_policy_ref": {
    "entity_id": "30000000-0000-4000-8000-000000000009",
    "digest": "sha256:ffffffffffffffffffffffffffffffffffffffffffffffffffffffffffffffff"
  },
  "repository_inputs": [
    {
      "repository_ref": {
        "entity_id": "30000000-0000-4000-8000-000000000006",
        "digest": "sha256:aaaaaaaaaaaaaaaaaaaaaaaaaaaaaaaaaaaaaaaaaaaaaaaaaaaaaaaaaaaaaaaa"
      },
      "base_branch": "main",
      "base_commit": {
        "algorithm": "sha1",
        "value": "1111111111111111111111111111111111111111"
      },
      "repository_policy_ref": {
        "entity_id": "30000000-0000-4000-8000-000000000007",
        "digest": "sha256:bbbbbbbbbbbbbbbbbbbbbbbbbbbbbbbbbbbbbbbbbbbbbbbbbbbbbbbbbbbbbbbb"
      },
      "context_input_ref": {
        "object_id": "30000000-0000-4000-8000-000000000010",
        "digest": "sha256:cccccccccccccccccccccccccccccccccccccccccccccccccccccccccccccccc",
        "size_bytes": 1024,
        "media_type": "application/json"
      }
    }
  ],
  "protected_inputs": [
    {
      "object_ref": {
        "object_id": "30000000-0000-4000-8000-000000000010",
        "digest": "sha256:cccccccccccccccccccccccccccccccccccccccccccccccccccccccccccccccc",
        "size_bytes": 1024,
        "media_type": "application/json"
      },
      "material_version_id": "30000000-0000-4000-8000-000000000041",
      "access_envelope_id": "30000000-0000-4000-8000-000000000042",
      "classification": "INTERNAL",
      "input_kind": "CONTEXT_INPUT"
    }
  ],
  "human_owner_ids": [
    "30000000-0000-4000-8000-000000000024"
  ],
  "gate_assignments": [
    {
      "gate_type": "CODE_READINESS",
      "gate_assignment_id": "30000000-0000-4000-8000-000000000052",
      "approver_user_id": "30000000-0000-4000-8000-000000000023"
    },
    {
      "gate_type": "PLAN_APPROVAL",
      "gate_assignment_id": "30000000-0000-4000-8000-000000000051",
      "approver_user_id": "30000000-0000-4000-8000-000000000022"
    },
    {
      "gate_type": "PRD_APPROVAL",
      "gate_assignment_id": "30000000-0000-4000-8000-000000000050",
      "approver_user_id": "30000000-0000-4000-8000-000000000021"
    }
  ],
  "digest": "sha256:3c01dc7c09ea99fc64b3ad9796b4b11b0ec50b8c6da3dcd7a677f400b73616e7"
}
